<?xml version="1.0" encoding="UTF-8" ?>
<commande xmlns  				= "http://www.example.org/commande"
		  xmlns:xsi				= "http://www.w3.org/2001/XMLSchema-instance"
		  xsi:schemaLocation 	= "http://www.example.org/commande commande.xsd">
	<reference>refcommande1</reference>
	<date>2016-10-21-10:30</date>
	<produits>
		<produit>
			<reference>refproduit1</reference>
			<quantite>10</quantite>
			<prix></prix>
		</produit>
		<produit>
			<reference>refproduit2</reference>
			<quantite>5</quantite>
			<prix></prix>
		</produit>
	</produits>
</commande>
